{
  "schemaVersion": 1,
  "supportRecordId": "org.example.support-redacted",
  "supportState": "NoFormalSupport",
  "components": [
    {
      "uiId": "org.example.redacted-webui",
      "uiVersion": "0.0.0-redacted",
      "sourceRev": "REDACTED"
    }
  ],
  "baseline": {
    "harnessCommit": "0000000000000000000000000000000000000000",
    "lanPluginVersion": "0.0.0-redacted",
    "routeVersion": "REDACTED"
  },
  "contractVersion": "1.0.0",
  "registryVersion": 1,
  "rules": [],
  "launcher": {
    "version": "0.0.0-redacted",
    "installerSha256": "0000000000000000000000000000000000000000000000000000000000000000",
    "signatureStatus": "not-applicable"
  },
  "runtimeEvidence": {
    "minimumRuntime": {
      "version": "REDACTED",
      "result": "NOT_APPLICABLE"
    },
    "evergreenRuntime": {
      "version": "REDACTED",
      "result": "NOT_APPLICABLE"
    },
    "sameEndpointEdge": {
      "version": "REDACTED",
      "result": "NOT_APPLICABLE"
    }
  },
  "fixtureIdentity": "0000000000000000000000000000000000000000000000000000000000000000",
  "structuredEvidenceSha256": "0000000000000000000000000000000000000000000000000000000000000000",
  "supportScope": [
    "No formal support is claimed by this redacted example."
  ],
  "knownLimitations": [
    "All identifying evidence is redacted."
  ],
  "lastVerifiedAt": "2026-08-31T00:00:00Z",
  "reviewDueAt": "2026-08-31T00:00:00Z",
  "ownerRef": "role.redacted-owner"
}
